{
  "$schema": "https://json-schema.org/draft/2020-12/schema",
  "$id": "https://github.com/GustavoGutierrez/alisio-plugins/tree/main/packages/plugin-frontsmith/schemas/architecture.schema.json",
  "title": "Frontsmith architecture configuration",
  "description": "Editor completion for .frontsmith/architecture.json. The hand-written validator in the plugin is authoritative.",
  "type": "object",
  "additionalProperties": false,
  "required": ["schemaVersion", "layers", "allow"],
  "properties": {
    "$schema": { "type": "string", "minLength": 1, "maxLength": 512 },
    "schemaVersion": { "const": 1 },
    "preset": { "type": "string", "minLength": 1, "maxLength": 40 },
    "sourceRoots": { "type": "array", "maxItems": 20, "items": { "$ref": "#/$defs/relativePath" } },
    "aliases": { "enum": ["tsconfig", "none"] },
    "layers": {
      "type": "array",
      "minItems": 1,
      "maxItems": 40,
      "items": {
        "type": "object",
        "additionalProperties": false,
        "required": ["name", "paths"],
        "properties": {
          "name": { "type": "string", "pattern": "^[a-z][a-z0-9-]*$", "maxLength": 40 },
          "paths": {
            "type": "array",
            "minItems": 1,
            "maxItems": 50,
            "items": { "$ref": "#/$defs/glob" }
          }
        }
      }
    },
    "allow": {
      "type": "object",
      "additionalProperties": { "type": "array", "items": { "type": "string" } }
    },
    "allowSameLayer": { "type": "array", "items": { "type": "string" } },
    "slices": {
      "type": "object",
      "additionalProperties": false,
      "required": ["layers", "depth", "publicApi"],
      "properties": {
        "layers": { "type": "array", "items": { "type": "string" } },
        "depth": { "type": "integer", "minimum": 1 },
        "publicApi": { "type": "array", "items": { "type": "string", "minLength": 1 } }
      }
    },
    "roles": {
      "type": "object",
      "additionalProperties": false,
      "required": ["presentational", "forbiddenForPresentational"],
      "properties": {
        "presentational": { "type": "array", "items": { "$ref": "#/$defs/glob" } },
        "forbiddenForPresentational": {
          "type": "array",
          "items": { "type": "string", "minLength": 1 }
        }
      }
    },
    "atomic": {
      "oneOf": [
        { "type": "null" },
        {
          "type": "object",
          "additionalProperties": false,
          "required": ["levels", "paths"],
          "properties": {
            "levels": { "type": "array", "minItems": 1, "items": { "type": "string" } },
            "paths": {
              "type": "object",
              "additionalProperties": { "type": "array", "items": { "$ref": "#/$defs/glob" } }
            }
          }
        }
      ]
    },
    "ignore": { "type": "array", "maxItems": 100, "items": { "$ref": "#/$defs/glob" } }
  },
  "$defs": {
    "relativePath": { "type": "string", "minLength": 1, "maxLength": 300 },
    "glob": { "type": "string", "minLength": 1, "maxLength": 300 }
  }
}
